[
  {
    "source": "scopus",
    "title": "  Electoral Integrity  ",
    "authors": [
      "  Smith, J.  "
    ],
    "year": 2021,
    "doi": null
  },
  {
    "source": "crossref",
    "title": "Electoral Integrity",
    "authors": [
      "Smith, J."
    ],
    "year": 2021,
    "doi": ""
  }
]